{
  "id": "0f6a7b8c-1d2e-4f30-9a1b-000000000004",
  "type": "DocumentDeleted",
  "version": 1,
  "time": "2026-09-02T08:00:00Z",
  "doc_id": "3f786850e387550fdab836ed7e6dc881de23001b1b6e9c02a6a5f4f8a5b7c9d1",
  "trace_id": "4bf92f3577b34da6a3ce929d0e0e4736",
  "source": "gateway",
  "data": {
    "reason": "user_request",
    "requested_by": "9c1d3e5f7a2b4c6d"
  }
}
